{
  "$schema": "https://json-schema.org/draft/2020-12/schema",
  "$id": "evaluation_result.schema.json",
  "title": "EvaluationResult",
  "description": "The response the engine returns for one piece of content. Contains no content text and no raw prompts, so it is safe to log widely. Join to the restricted audit record on request_id.",
  "type": "object",
  "required": [
    "schema_version", "execution_kind", "request_id", "policy_name", "policy_version", "policy_sha256",
    "mode", "evaluated_at", "evaluation_strategy", "threshold", "score",
    "final_verdict", "decision_reason", "triggered_rules", "uncertain_rules", "review_reasons",
    "rule_results", "skipped_rules", "content", "totals", "total_latency_ms"
  ],
  "additionalProperties": false,
  "properties": {
    "schema_version": { "const": "1.1" },
    "execution_kind": {
      "enum": ["live", "mock"],
      "description": "live is a real judge run. mock must not be read later as measured performance."
    },
    "request_id": { "type": "string", "description": "UUID4 generated per evaluation. Primary key for the audit record." },
    "policy_name": { "type": "string" },
    "policy_version": { "type": "string" },
    "policy_sha256": { "type": "string", "pattern": "^[0-9a-f]{64}$", "description": "Hash of the policy file bytes used. Proves exactly which prompts and weights were in force." },
    "mode": { "enum": ["input", "output"] },
    "evaluated_at": { "type": "string", "format": "date-time", "description": "UTC, ISO 8601, when evaluation started." },
    "evaluation_strategy": { "enum": ["all", "any", "weighted_threshold"] },
    "threshold": { "type": ["number", "null"], "description": "Threshold in force. Null unless strategy is weighted_threshold." },
    "score": { "type": ["number", "null"], "minimum": 0, "maximum": 1, "description": "Weighted risk score. Null unless strategy is weighted_threshold." },
    "final_verdict": { "enum": ["ALLOW", "REDACT", "REVIEW", "BLOCK"] },
    "decision_reason": {
      "enum": ["no_trigger", "needs_review", "threshold_met", "one_violation", "all_rules_failed"],
      "description": "Locked to final_verdict and evaluation_strategy. ALLOW is no_trigger. REVIEW is needs_review. BLOCK and REDACT are threshold_met under weighted_threshold, one_violation under all (any failing rule violates), and all_rules_failed under any (every applicable rule failed)."
    },
    "triggered_rules": { "type": "array", "items": { "type": "string" }, "description": "Rules whose FAIL counted toward the decision." },
    "uncertain_rules": { "type": "array", "items": { "type": "string" }, "description": "Rules that returned UNCERTAIN or errored." },
    "review_reasons": {
      "type": "array",
      "items": { "enum": ["uncertain_rule", "judge_error", "score_in_review_margin", "content_truncated"] },
      "description": "Why the verdict is REVIEW, or why REVIEW was part of the decision. Empty if not."
    },
    "rule_results": {
      "type": "array",
      "description": "One entry per rule that ran, in policy order.",
      "items": { "$ref": "#/$defs/rule_result" }
    },
    "skipped_rules": {
      "type": "array",
      "items": {
        "type": "object",
        "required": ["rule_id", "reason"],
        "additionalProperties": false,
        "properties": {
          "rule_id": { "type": "string" },
          "reason": { "const": "not_applicable_to_mode" }
        }
      }
    },
    "content": {
      "type": "object",
      "required": ["sha256", "chars", "truncated"],
      "additionalProperties": false,
      "properties": {
        "sha256": {
          "type": "string",
          "pattern": "^[0-9a-f]{64}$",
          "description": "SHA-256 hex of the UTF-8 bytes of json.dumps({\"mode\": mode, \"text\": text}, ensure_ascii=False, sort_keys=True, separators=(\",\", \":\")). No trimming and no Unicode normalization. The original text is hashed, not a truncated copy. The same characters hash differently as input and as output because mode is part of the preimage."
        },
        "chars": { "type": "integer", "minimum": 0 },
        "truncated": { "type": "boolean", "description": "True if content exceeded max_content_chars and the judges saw a truncated copy." }
      }
    },
    "totals": {
      "type": "object",
      "additionalProperties": false,
      "required": ["attempt_count", "input_tokens", "output_tokens", "cost_usd"],
      "description": "Sums over every attempt, including failed ones. If any attempt left a token count or cost unreported, that total is null. Do not write 0 for an unknown figure.",
      "properties": {
        "attempt_count": { "type": "integer", "minimum": 0 },
        "input_tokens": { "type": ["integer", "null"], "minimum": 0 },
        "output_tokens": { "type": ["integer", "null"], "minimum": 0 },
        "cost_usd": { "type": ["number", "null"], "minimum": 0 }
      }
    },
    "total_latency_ms": { "type": "integer", "minimum": 0, "description": "Wall-clock for the whole evaluation. With parallel rules this is close to the slowest rule, not the sum." }
  },
  "allOf": [
    {
      "if": { "properties": { "final_verdict": { "const": "ALLOW" } }, "required": ["final_verdict"] },
      "then": { "properties": { "decision_reason": { "const": "no_trigger" } } }
    },
    {
      "if": { "properties": { "final_verdict": { "const": "REVIEW" } }, "required": ["final_verdict"] },
      "then": { "properties": { "decision_reason": { "const": "needs_review" } } }
    },
    {
      "if": {
        "properties": {
          "final_verdict": { "enum": ["BLOCK", "REDACT"] },
          "evaluation_strategy": { "const": "weighted_threshold" }
        },
        "required": ["final_verdict", "evaluation_strategy"]
      },
      "then": { "properties": { "decision_reason": { "const": "threshold_met" } } }
    },
    {
      "if": {
        "properties": {
          "final_verdict": { "enum": ["BLOCK", "REDACT"] },
          "evaluation_strategy": { "const": "all" }
        },
        "required": ["final_verdict", "evaluation_strategy"]
      },
      "then": { "properties": { "decision_reason": { "const": "one_violation" } } }
    },
    {
      "if": {
        "properties": {
          "final_verdict": { "enum": ["BLOCK", "REDACT"] },
          "evaluation_strategy": { "const": "any" }
        },
        "required": ["final_verdict", "evaluation_strategy"]
      },
      "then": { "properties": { "decision_reason": { "const": "all_rules_failed" } } }
    }
  ],
  "$defs": {
    "rule_result": {
      "type": "object",
      "required": [
        "rule_id", "verdict", "confidence", "reasoning", "action", "weight",
        "risk_contribution", "judge_model", "attempts", "latency_ms", "error"
      ],
      "additionalProperties": false,
      "properties": {
        "rule_id": { "type": "string" },
        "verdict": { "enum": ["PASS", "FAIL", "UNCERTAIN"] },
        "confidence": { "type": "number", "minimum": 0, "maximum": 1, "description": "The judge's confidence in its verdict. 0 when the judge errored." },
        "reasoning": { "type": "string", "description": "From the judge. For errors the engine writes a short fixed message." },
        "action": {
          "enum": ["none", "redact", "block", "review"],
          "description": "FAIL -> the rule's on_fail. UNCERTAIN or error -> review. PASS -> none."
        },
        "weight": { "type": "number", "minimum": 0, "maximum": 1 },
        "risk_contribution": { "type": "number", "minimum": 0, "maximum": 1, "description": "weight * confidence if FAIL, else 0. The term that enters the noisy-OR score." },
        "judge_model": { "type": "string" },
        "attempts": { "type": "integer", "minimum": 1, "description": "Judge calls made for this rule (1 = no retry)." },
        "latency_ms": { "type": "integer", "minimum": 0, "description": "Total time for this rule including retries and backoff." },
        "error": {
          "oneOf": [
            { "type": "null" },
            {
              "type": "object",
              "required": ["type", "message"],
              "additionalProperties": false,
              "properties": {
                "type": {
                  "enum": ["timeout", "rate_limit", "server_error", "transport_error", "client_error", "evaluation_deadline", "unparseable"]
                },
                "message": { "type": "string" }
              }
            }
          ],
          "description": "Set only when the rule never produced a valid judge response. Then verdict is UNCERTAIN."
        }
      }
    }
  }
}
